{
  "version": 1,
  "slug": "north-beach-pool",
  "pdf_sha256": "025a9d1fc08636dccec6430dedb16012a5e4539885898a2789a6ba5df8f30c07",
  "reviewed_at": "2026-04-17",
  "source_pdf_url": "https://sfrecpark.org/DocumentCenter/View/28503",
  "reviewed_against": [
    {
      "provider": "gemini",
      "model": "gemini-3-1-flash-lite-preview",
      "artifact_relpath": "data/artifacts/north-beach-pool/025a9d1fc086/gemini-gemini-3-1-flash-lite-preview.json"
    },
    {
      "provider": "anthropic",
      "model": "claude-sonnet-4-6",
      "artifact_relpath": "data/artifacts/north-beach-pool/025a9d1fc086/anthropic-claude-sonnet-4-6.json"
    }
  ],
  "payload": {
    "schedule_effective": "2026-03-17",
    "schedule_effective_end": "2026-06-06",
    "sessions": [
      {
        "day": "tuesday",
        "type": "lap_swim",
        "start": "07:30",
        "end": "08:30"
      },
      {
        "day": "tuesday",
        "type": "lap_swim",
        "start": "07:30",
        "end": "10:00"
      },
      {
        "day": "tuesday",
        "type": "senior_swim",
        "start": "08:45",
        "end": "10:00"
      },
      {
        "day": "tuesday",
        "type": "lap_swim",
        "start": "12:30",
        "end": "15:00"
      },
      {
        "day": "tuesday",
        "type": "lap_swim",
        "start": "12:30",
        "end": "15:30"
      },
      {
        "day": "tuesday",
        "type": "senior_swim",
        "start": "12:50",
        "end": "15:15"
      },
      {
        "day": "tuesday",
        "type": "family_swim",
        "start": "15:30",
        "end": "17:00"
      },
      {
        "day": "tuesday",
        "type": "lap_swim",
        "start": "17:30",
        "end": "18:30"
      },
      {
        "day": "wednesday",
        "type": "lap_swim",
        "start": "07:30",
        "end": "08:30"
      },
      {
        "day": "wednesday",
        "type": "lap_swim",
        "start": "09:00",
        "end": "10:15"
      },
      {
        "day": "wednesday",
        "type": "senior_swim",
        "start": "09:00",
        "end": "10:15"
      },
      {
        "day": "wednesday",
        "type": "lap_swim",
        "start": "11:45",
        "end": "12:45"
      },
      {
        "day": "wednesday",
        "type": "lap_swim",
        "start": "11:45",
        "end": "15:30"
      },
      {
        "day": "wednesday",
        "type": "lessons",
        "start": "15:45",
        "end": "16:15"
      },
      {
        "day": "wednesday",
        "type": "lessons",
        "start": "16:30",
        "end": "17:00"
      },
      {
        "day": "wednesday",
        "type": "family_swim",
        "start": "17:30",
        "end": "18:30"
      },
      {
        "day": "wednesday",
        "type": "lap_swim",
        "start": "17:30",
        "end": "18:30"
      },
      {
        "day": "thursday",
        "type": "lap_swim",
        "start": "07:30",
        "end": "08:30"
      },
      {
        "day": "thursday",
        "type": "lap_swim",
        "start": "07:30",
        "end": "10:30"
      },
      {
        "day": "thursday",
        "type": "senior_swim",
        "start": "09:00",
        "end": "10:30"
      },
      {
        "day": "thursday",
        "type": "lap_swim",
        "start": "11:00",
        "end": "14:00"
      },
      {
        "day": "thursday",
        "type": "lap_swim",
        "start": "14:15",
        "end": "15:15"
      },
      {
        "day": "thursday",
        "type": "lessons",
        "start": "15:20",
        "end": "15:50"
      },
      {
        "day": "thursday",
        "type": "family_swim",
        "start": "16:15",
        "end": "17:30"
      },
      {
        "day": "thursday",
        "type": "lap_swim",
        "start": "17:30",
        "end": "18:30"
      },
      {
        "day": "friday",
        "type": "lap_swim",
        "start": "09:00",
        "end": "10:15"
      },
      {
        "day": "friday",
        "type": "senior_swim",
        "start": "09:00",
        "end": "10:15"
      },
      {
        "day": "friday",
        "type": "lap_swim",
        "start": "11:45",
        "end": "12:45"
      },
      {
        "day": "friday",
        "type": "lap_swim",
        "start": "11:45",
        "end": "15:30"
      },
      {
        "day": "friday",
        "type": "senior_swim",
        "start": "12:50",
        "end": "15:15"
      },
      {
        "day": "friday",
        "type": "lessons",
        "start": "15:45",
        "end": "16:15"
      },
      {
        "day": "friday",
        "type": "lessons",
        "start": "16:30",
        "end": "17:00"
      },
      {
        "day": "friday",
        "type": "family_swim",
        "start": "17:30",
        "end": "19:00"
      },
      {
        "day": "friday",
        "type": "lap_swim",
        "start": "17:30",
        "end": "19:30"
      },
      {
        "day": "saturday",
        "type": "lessons",
        "start": "09:00",
        "end": "09:30"
      },
      {
        "day": "saturday",
        "type": "lessons",
        "start": "09:00",
        "end": "10:00"
      },
      {
        "day": "saturday",
        "type": "lessons",
        "start": "09:45",
        "end": "10:15"
      },
      {
        "day": "saturday",
        "type": "lessons",
        "start": "10:15",
        "end": "11:15"
      },
      {
        "day": "saturday",
        "type": "lessons",
        "start": "10:30",
        "end": "11:00"
      },
      {
        "day": "saturday",
        "type": "lap_swim",
        "start": "12:00",
        "end": "13:15"
      },
      {
        "day": "saturday",
        "type": "lap_swim",
        "start": "12:00",
        "end": "14:00"
      },
      {
        "day": "saturday",
        "type": "family_swim",
        "start": "13:45",
        "end": "15:00"
      },
      {
        "day": "saturday",
        "type": "lap_swim",
        "start": "14:30",
        "end": "16:30"
      },
      {
        "day": "saturday",
        "type": "family_swim",
        "start": "15:30",
        "end": "17:00"
      },
      {
        "day": "saturday",
        "type": "lessons",
        "start": "16:30",
        "end": "17:00"
      }
    ],
    "closures": [
      {
        "start": "2026-03-19",
        "end": "2026-03-19",
        "reason": "Aquatic Division Training"
      },
      {
        "start": "2026-04-16",
        "end": "2026-04-16",
        "reason": "Aquatic Division Training"
      },
      {
        "start": "2026-05-21",
        "end": "2026-05-21",
        "reason": "Aquatic Division Training"
      },
      {
        "start": "2026-05-25",
        "end": "2026-05-25",
        "reason": "Holiday Closure"
      },
      {
        "start": "2026-06-06",
        "end": "2026-06-06",
        "reason": "In-Service Training"
      },
      {
        "start": "2026-06-19",
        "end": "2026-06-19",
        "reason": "Holiday Closure"
      }
    ]
  }
}
