{
  "version": 1,
  "slug": "rossi-pool",
  "pdf_sha256": "f580f358615eb222d31249ebe28d5a67fe9d7aa473493559754696849d8c798f",
  "reviewed_at": "2026-04-17",
  "source_pdf_url": "https://sfrecpark.org/DocumentCenter/View/28501",
  "reviewed_against": [
    {
      "provider": "anthropic",
      "model": "claude-sonnet-4-6",
      "artifact_relpath": "data/artifacts/rossi-pool/f580f358615e/anthropic-claude-sonnet-4-6.json"
    },
    {
      "provider": "gemini",
      "model": "gemini-3-1-flash-lite-preview",
      "artifact_relpath": "data/artifacts/rossi-pool/f580f358615e/gemini-gemini-3-1-flash-lite-preview.json"
    }
  ],
  "payload": {
    "closures": [
      {
        "end": "2026-03-19",
        "reason": "Training",
        "start": "2026-03-19"
      },
      {
        "end": "2026-04-16",
        "reason": "Training",
        "start": "2026-04-16"
      },
      {
        "end": "2026-05-21",
        "reason": "Training",
        "start": "2026-05-21"
      },
      {
        "end": "2026-05-25",
        "reason": "Federal Holiday",
        "start": "2026-05-25"
      },
      {
        "end": "2026-06-19",
        "reason": "Federal Holiday",
        "start": "2026-06-19"
      }
    ],
    "schedule_effective": "2026-03-15",
    "schedule_effective_end": "2026-06-04",
    "sessions": [
      {
        "day": "monday",
        "end": "10:00",
        "start": "07:30",
        "type": "lap_swim"
      },
      {
        "day": "monday",
        "end": "11:30",
        "start": "10:15",
        "type": "lessons"
      },
      {
        "day": "monday",
        "end": "13:00",
        "start": "11:45",
        "type": "senior_swim"
      },
      {
        "day": "monday",
        "end": "15:30",
        "start": "13:30",
        "type": "lap_swim"
      },
      {
        "day": "monday",
        "end": "19:30",
        "start": "18:15",
        "type": "lap_swim"
      },
      {
        "day": "tuesday",
        "end": "10:00",
        "start": "07:30",
        "type": "lap_swim"
      },
      {
        "day": "tuesday",
        "end": "12:00",
        "start": "10:15",
        "type": "senior_swim"
      },
      {
        "day": "tuesday",
        "end": "15:30",
        "start": "12:30",
        "type": "lap_swim"
      },
      {
        "day": "tuesday",
        "end": "19:30",
        "start": "18:15",
        "type": "family_swim"
      },
      {
        "day": "wednesday",
        "end": "10:45",
        "start": "09:00",
        "type": "senior_swim"
      },
      {
        "day": "wednesday",
        "end": "13:30",
        "start": "11:00",
        "type": "lap_swim"
      },
      {
        "day": "wednesday",
        "end": "15:30",
        "start": "14:00",
        "type": "family_swim"
      },
      {
        "day": "thursday",
        "end": "10:00",
        "start": "07:30",
        "type": "lap_swim"
      },
      {
        "day": "thursday",
        "end": "11:45",
        "start": "10:15",
        "type": "senior_swim"
      },
      {
        "day": "thursday",
        "end": "15:30",
        "start": "12:30",
        "type": "lap_swim"
      },
      {
        "day": "thursday",
        "end": "19:30",
        "start": "18:15",
        "type": "family_swim"
      },
      {
        "day": "sunday",
        "end": "08:30",
        "start": "07:30",
        "type": "lap_swim"
      },
      {
        "day": "sunday",
        "end": "11:00",
        "start": "09:00",
        "type": "lessons"
      },
      {
        "day": "sunday",
        "end": "14:00",
        "start": "12:30",
        "type": "family_swim"
      },
      {
        "day": "sunday",
        "end": "15:30",
        "start": "14:30",
        "type": "family_swim"
      },
      {
        "day": "tuesday",
        "end": "19:30",
        "start": "18:15",
        "type": "lap_swim"
      },
      {
        "day": "wednesday",
        "end": "15:30",
        "start": "14:00",
        "type": "lap_swim"
      },
      {
        "day": "thursday",
        "end": "19:30",
        "start": "18:15",
        "type": "lap_swim"
      }
    ]
  }
}
